{
  "schema_version": 2,
  "change_id": "chg_20260717T160100Z_11223344",
  "created_at": "2026-07-17T16:01:00Z",
  "user_request": "Clarify the valid SBR finisher description.",
  "intent": "UPDATE_METRIC",
  "mode": "PROPOSE",
  "canonical_metric_name": "valid_sbr_finishers",
  "canonical_file": "models/semantic/triathlon_semantic.yml",
  "requested_semantic_change": "Change the description only.",
  "operation": {
    "kind": "SET_DESCRIPTION",
    "value": "Number of valid finishers with complete swim, bike, and run splits."
  },
  "affected_targets": ["CANONICAL_DBT", "POWER_BI", "SNOWFLAKE"],
  "target_support": {
    "CANONICAL_DBT": "METADATA_ONLY",
    "POWER_BI": "METADATA_ONLY",
    "SNOWFLAKE": "METADATA_ONLY"
  },
  "status": "DRAFT",
  "approval_state": "NOT_REQUESTED",
  "validation_state": "NOT_RUN",
  "deployment_requested": false,
  "deployment_state": "NOT_REQUESTED",
  "assumptions": [],
  "diagnostics": []
}
